"type","id","author","editor","advisor","note","title","pages","article_no","num_pages","keywords","doi","journal","issue_date","volume","issue_no","description","month","year","issn","booktitle","acronym","edition","isbn","conf_loc","publisher","publisher_loc"
"article","2544302","Shiva  Azadegan and Josh  Dehlinger and Siddharth  Kaza","","","","Revitalizing the Computer Science Undergraduate Curriculum Inside and Outside of the Classroom Using Mobile Computing Platforms (Abstract Only)","713--713","","1","computer science education, mobile computing","10.1145/2538862.2544302","","","","","","","2014","","Proceedings of the 45th ACM Technical Symposium on Computer Science Education","SIGCSE '14","","978-1-4503-2605-6","Atlanta, Georgia, USA","ACM","New York, NY, USA"
"article","2184628","Jeff  Gray and Hal  Abelson and David  Wolber and Michelle  Friend","","","","Teaching CS Principles with App Inventor","405--406","","2","computer science education, mobile computing","10.1145/2184512.2184628","","","","","","","2012","","Proceedings of the 50th Annual Southeast Regional Conference","ACM-SE '12","","978-1-4503-1203-5","Tuscaloosa, Alabama","ACM","New York, NY, USA"
"article","2899455","Ilias O. Pappas and Michail N. Giannakos and Letizia  Jaccheri","","","","Investigating Factors Influencing Students' Intention to Dropout Computer Science Studies","198--203","","6","computer science education, dropout, higher education., retention","10.1145/2899415.2899455","","","","","","","2016","","Proceedings of the 2016 ACM Conference on Innovation and Technology in Computer Science Education","ITiCSE '16","","978-1-4503-4231-5","Arequipa, Peru","ACM","New York, NY, USA"
"article","2835586","Antti  Oulasvirta and Tuomo  Nyyss&#246;nen","","","","Flexible Hardware Configurations for Studying Mobile Usability","93--105","","13","field studies, hardware, mobile usability, usability labs","","J. Usability Studies","February 2009","4","2","","February","2009","1931-3357","","","","","","Usability Professionals' Association","Bloomingdale, IL"
"article","2000762","Norlaila  Hussain and Oscar  de Bruijn","","","","The Effects of Distinctiveness on the Use of Workspace and Grabbing of Other's Documents","41--48","","8","computer-supported collaborative design, distinctiveness, interactive tabletop, workspace","10.1145/2000756.2000762","","","","","","","2011","","Proceedings of the 12th Annual Conference of the New Zealand Chapter of the ACM Special Interest Group on Computer-Human Interaction","CHINZ '11","","978-1-4503-0676-8","Hamilton, New Zealand","ACM","New York, NY, USA"
"article","3053345","Agnes  Lisowska Masson and Timon  Amstutz and Denis  Lalanne","","","","A Usability Refactoring Process for Large-Scale Open Source Projects: The ILIAS Case Study","1135--1143","","9","learning management systems, open source communities, open source software, usability","10.1145/3027063.3053345","","","","","","","2017","","Proceedings of the 2017 CHI Conference Extended Abstracts on Human Factors in Computing Systems","CHI EA '17","","978-1-4503-4656-6","Denver, Colorado, USA","ACM","New York, NY, USA"
"article","1536559","Dustin B. Chertoff and Ross W. Byers and Joseph J. LaViola,Jr.","","","","An Exploration of Menu Techniques Using a 3D Game Input Device","256--262","","7","3D interaction, input devices, usability, user studies, video games","10.1145/1536513.1536559","","","","","","","2009","","Proceedings of the 4th International Conference on Foundations of Digital Games","FDG '09","","978-1-60558-437-9","Orlando, Florida","ACM","New York, NY, USA"
"article","2677247","Michael K. Bradshaw","","","","Ante Up: A Framework to Strengthen Student-Based Testing of Assignments","488--493","","6","c++, education, java, lms, moodle, python, testing","10.1145/2676723.2677247","","","","","","","2015","","Proceedings of the 46th ACM Technical Symposium on Computer Science Education","SIGCSE '15","","978-1-4503-2966-8","Kansas City, Missouri, USA","ACM","New York, NY, USA"
"article","1056983","Tim  Marsh and Kiyoung  Yang and Cyrus  Shahabi and Wee Ling Wong and Luciano  Nocera and Eduardo  Carriazo and Aditya  Varma and Hyunjin  Yoon and Chris  Kyriakakis","","","","Automating the Detection of Breaks in Continuous User Experience with Computer Games","1629--1632","","4","3D mediated environments, computer games, database storage and query, digital games, evaluation, presence, usability, user experience","10.1145/1056808.1056983","","","","","","","2005","","CHI '05 Extended Abstracts on Human Factors in Computing Systems","CHI EA '05","","1-59593-002-7","Portland, OR, USA","ACM","New York, NY, USA"
"article","2420965","Paul  Dunphy and Patrick  Olivier","","","","On Automated Image Choice for Secure and Usable Graphical Passwords","99--108","","10","security, usability, user authentication","10.1145/2420950.2420965","","","","","","","2012","","Proceedings of the 28th Annual Computer Security Applications Conference","ACSAC '12","","978-1-4503-1312-4","Orlando, Florida, USA","ACM","New York, NY, USA"
"article","1572546","Alfred  Kobsa and Rahim  Sonawalla and Gene  Tsudik and Ersin  Uzun and Yang  Wang","","","","Serial Hook-ups: A Comparative Usability Study of Secure Device Pairing Methods","10:1--10:12","10","12","","10.1145/1572532.1572546","","","","","","","2009","","Proceedings of the 5th Symposium on Usable Privacy and Security","SOUPS '09","","978-1-60558-736-3","Mountain View, California, USA","ACM","New York, NY, USA"
"article","1570437","Bonnie E. John and Len  Bass and Elspeth  Golden and Pia  Stoll","","","","A Responsibility-based Pattern Language for Usability-supporting Architectural Patterns","3--12","","10","software architecture, usability","10.1145/1570433.1570437","","","","","","","2009","","Proceedings of the 1st ACM SIGCHI Symposium on Engineering Interactive Computing Systems","EICS '09","","978-1-60558-600-7","Pittsburgh, PA, USA","ACM","New York, NY, USA"
"article","2047475","Behzad Joze Hashemian","","","","Analyzing Web Accessibility in Finnish Higher Education","8--16","","9","Finnish education system, WCAG, disability, web accessibility","10.1145/2047473.2047475","SIGACCESS Access. Comput.","September 2011","","101","","September","2011","1558-2337","","","","","","ACM","New York, NY, USA"
"article","2016794","Steven I. Gordon and Judith  Gardiner","","","","Coming to Consensus on Competencies for Petascale Computing Education and Training","49:1--49:2","49","2","certification, computational science, curriculum, education, educational competencies","10.1145/2016741.2016794","","","","","","","2011","","Proceedings of the 2011 TeraGrid Conference: Extreme Digital Discovery","TG '11","","978-1-4503-0888-5","Salt Lake City, Utah","ACM","New York, NY, USA"
"article","1083468","Orit  Hazzan","","","","Professional Development Workshop for Female Software Engineers","75--79","","5","computer science education, gender, software engineering education","10.1145/1083431.1083468","SIGCSE Bull.","June 2005","37","2","","June","2005","0097-8418","","","","","","ACM","New York, NY, USA"
"article","2532751","Ben  Gibson and Tim  Bell","","","","Evaluation of Games for Teaching Computer Science","51--60","","10","computer science education, educational games, play","10.1145/2532748.2532751","","","","","","","2013","","Proceedings of the 8th Workshop in Primary and Secondary Computing Education","WiPSE '13","","978-1-4503-2455-7","Aarhus, Denmark","ACM","New York, NY, USA"
"article","2537777","Douglas  Baldwin and Henry M. Walker and Peter B. Henderson","","","","The Roles of Mathematics in Computer Science","74--80","","7","computer science education, mathematics, software engineering education","10.1145/2537753.2537777","ACM Inroads","December 2013","4","4","","December","2013","2153-2184","","","","","","ACM","New York, NY, USA"
"article","2407814","Sanjay  Tripathi","","","","An Overview of HCI Research and Usability Maturity in India: An Industrial Perspective","105--106","","2","human computer interaction, usability, usability maturity model (UMM)","10.1145/2407796.2407814","","","","","","","2011","","Proceedings of the 3rd International Conference on Human Computer Interaction","IndiaHCI '11","","978-1-4503-0729-1","Bangalore, India","ACM","New York, NY, USA"
"article","2813622","Jun Ho  Huh and Seongyeol  Oh and Hyoungshick  Kim and Konstantin  Beznosov and Apurva  Mohan and S. Raj  Rajagopalan","","","","Surpass: System-initiated User-replaceable Passwords","170--181","","12","passwords, policy, security, usability","10.1145/2810103.2813622","","","","","","","2015","","Proceedings of the 22Nd ACM SIGSAC Conference on Computer and Communications Security","CCS '15","","978-1-4503-3832-5","Denver, Colorado, USA","ACM","New York, NY, USA"
"article","632768","Rolf  Molich and Ann Damgaard Thomsen and Barbara  Karyukina and Lars  Schmidt and Meghan  Ede and Wilma  van Oel and Meeta  Arcuri","","","","Comparative Evaluation of Usability Tests","83--84","","2","evaluation, hotmail, thinking aloud, usability problem description, usability report, usability test problems, usability testing","10.1145/632716.632768","","","","","","","1999","","CHI '99 Extended Abstracts on Human Factors in Computing Systems","CHI EA '99","","1-58113-158-5","Pittsburgh, Pennsylvania","ACM","New York, NY, USA"
"article","1774155","Holger  R&#246;der","","","","Using Interaction Requirements to Operationalize Usability","318--319","","2","interaction design, requirements, usability","10.1145/1774088.1774155","","","","","","","2010","","Proceedings of the 2010 ACM Symposium on Applied Computing","SAC '10","","978-1-60558-639-7","Sierre, Switzerland","ACM","New York, NY, USA"
"article","2732701","Julio  Angulo and Simone  Fischer-H&#252;bner and Tobias  Pulls and Erik  W&#228;stlund","","","","Usable Transparency with the Data Track: A Tool for Visualizing Data Disclosures","1803--1808","","6","information visualisations, privacy, usability, usable transparency","10.1145/2702613.2732701","","","","","","","2015","","Proceedings of the 33rd Annual ACM Conference Extended Abstracts on Human Factors in Computing Systems","CHI EA '15","","978-1-4503-3146-3","Seoul, Republic of Korea","ACM","New York, NY, USA"
"article","2044372","Simon T. Perrault and Gilles  Bailly and Yves  Guiard and Eric  Lecolinet","","","","Promesses Et Contraintes De La Joaillerie Num\'{E}Rique Interactive: Un Aper\c{C}U De L'\'{E}Tat De L'Art","14:1--14:4","14","4","interactive digital jewelry, miniaturization, usability, wearable computing","10.1145/2044354.2044372","","","","","","","2011","","Proceedings of the 23rd Conference on L'Interaction Homme-Machine","IHM '11","","978-1-4503-0822-9","Sophia Antipolis, France","ACM","New York, NY, USA"
"article","1378147","Ahmad  Rahmati and Lin  Zhong","","","","Usability Evaluation of a Commercial Pocket PC Phone: A Pilot Study","520--523","","4","Smartphones, human-computer interaction, mobile phones, usability","10.1145/1378063.1378147","","","","","","","2007","","Proceedings of the 4th International Conference on Mobile Technology, Applications, and Systems and the 1st International Symposium on Computer Human Interaction in Mobile Technology","Mobility '07","","978-1-59593-819-0","Singapore","ACM","New York, NY, USA"
"article","1067567","David G. Kay and Andr&#233;  van der Hoek and Debra J. Richardson","","","","Extending Undergraduate CS Programs with Informatics: Emphasizing Software and System Design in Context","367--367","","1","computer science education, contextual learning, education, informatics, software engineering education","10.1145/1151954.1067567","SIGCSE Bull.","September 2005","37","3","","June","2005","0097-8418","","","","","","ACM","New York, NY, USA"
"article","1067567","David G. Kay and Andr&#233;  van der Hoek and Debra J. Richardson","","","","Extending Undergraduate CS Programs with Informatics: Emphasizing Software and System Design in Context","367--367","","1","computer science education, contextual learning, education, informatics, software engineering education","10.1145/1067445.1067567","","","","","","","2005","","Proceedings of the 10th Annual SIGCSE Conference on Innovation and Technology in Computer Science Education","ITiCSE '05","","1-59593-024-8","Caparica, Portugal","ACM","New York, NY, USA"
"article","2739014","Christian  K&#246;ppe","","","","Towards a Pattern Language for Lecture Design: An Inventory and Categorization of Existing Lecture-relevant Patterns","3:1--3:17","3","17","education, educational patterns, lectures","10.1145/2739011.2739014","","","","","","","2015","","Proceedings of the 18th European Conference on Pattern Languages of Program","EuroPLoP '13","","978-1-4503-3465-5","Irsee, Germany","ACM","New York, NY, USA"
"article","1999811","Chenglie  Hu","","","","Computational Thinking: What It Might Mean and What We Might Do About It","223--227","","5","computation, computational thinking, computing education, thinking model","10.1145/1999747.1999811","","","","","","","2011","","Proceedings of the 16th Annual Joint Conference on Innovation and Technology in Computer Science Education","ITiCSE '11","","978-1-4503-0697-3","Darmstadt, Germany","ACM","New York, NY, USA"
"article","267470","Licia  Calvi and Paul  De Bra","","","","Improving the Usability of Hypertext Courseware Through Adaptive Linking","224--225","","2","adaptive interaction, dynamic link structure, hypertext courseware","10.1145/267437.267470","","","","","","","1997","","Proceedings of the Eighth ACM Conference on Hypertext","HYPERTEXT '97","","0-89791-866-5","Southampton, United Kingdom","ACM","New York, NY, USA"
"article","2000774","Rory  Clifford and Adrian  Clark and Mikhail  Rogozin","","","","Using Augmented Reality for Rapid Prototyping and Collaborative Design to Model 3D Buildings","117--120","","4","3D modeling, augmented reality, computer vision, design","10.1145/2000756.2000774","","","","","","","2011","","Proceedings of the 12th Annual Conference of the New Zealand Chapter of the ACM Special Interest Group on Computer-Human Interaction","CHINZ '11","","978-1-4503-0676-8","Hamilton, New Zealand","ACM","New York, NY, USA"
"article","1255096","Regina  Bernhaupt and Daniel  Schwaiger and Stefan  Riegler and David  Enthaler","","","","Evaluating Children's Gaming Experiences","224--225","","2","children, education, evaluation, game, global warming","10.1145/1255047.1255096","","","","","","","2007","","Proceedings of the International Conference on Advances in Computer Entertainment Technology","ACE '07","","978-1-59593-640-0","Salzburg, Austria","ACM","New York, NY, USA"
"article","3129428","A. S. Ajibola and L.  Goosen","","","","Development of Heuristics for Usability Evaluation of M-commerce Applications","3:1--3:10","3","10","mobile e-commerce usability, mobile usability, mobile usability issues, mobile usability methods, usability evaluation methods, usability methods","10.1145/3129416.3129428","","","","","","","2017","","Proceedings of the South African Institute of Computer Scientists and Information Technologists","SAICSIT '17","","978-1-4503-5250-5","Thaba 'Nchu, South Africa","ACM","New York, NY, USA"
"article","3017733","Sohum  Sohoni and Scotty D. Craig and Shaowen  Lu","","","","Impact of Prior Exposure to the PLP Instruction Set Architecture in a Computer Architecture Course","555--560","","6","computer architecture, computer science education, courseware, educational technology, engineering education","10.1145/3017680.3017733","","","","","","","2017","","Proceedings of the 2017 ACM SIGCSE Technical Symposium on Computer Science Education","SIGCSE '17","","978-1-4503-4698-6","Seattle, Washington, USA","ACM","New York, NY, USA"
"article","2851057","Matthew R. Steuerer","","","","Implementing K-Means Clustering and Collaborative Filtering to Enhance Sustainability of Project Repositories (Abstract Only)","724--724","","1","collaboration, social computational system, sustainability","10.1145/2839509.2851057","","","","","","","2016","","Proceedings of the 47th ACM Technical Symposium on Computing Science Education","SIGCSE '16","","978-1-4503-3685-7","Memphis, Tennessee, USA","ACM","New York, NY, USA"
"article","1035578","Shirley Ann Becker","","","","A Study of Web Usability for Older Adults Seeking Online Health Resources","387--406","","20","Aging, Web design, Web download time, Web usability, content accessibility, health literacy, older adults, user interfaces","10.1145/1035575.1035578","ACM Trans. Comput.-Hum. Interact.","December 2004","11","4","","December","2004","1073-0516","","","","","","ACM","New York, NY, USA"
"article","2817720","Joseph  Sharit and Miriam  Lisigurski and Allen D. Andrade and Chandana  Karanam and Kim M. Nazi and James R. Lewis and Jorge G. Ruiz","","","","The Roles of Health Literacy, Numeracy, and Graph Literacy on the Usability of the VA's Personal Health Record by Veterans","173--193","","21","aging, health management, numeracy and graph literacy skills, patient portal interface design, task performance, usability testing","","J. Usability Studies","August 2014","9","4","","August","2014","1931-3357","","","","","","Usability Professionals' Association","Bloomingdale, IL"
"article","2400092","Luiz Henrique A. Salazar and Tha&#237;sa  Lacerda and Christiane Gresse von Wangenheim and Rodrigo Ara&#250;jo Barbalho","","","","Customizando Heur\'{I}Sticas De Usabilidade Para Celulares","37--38","","2","mobile phone, smartphone, usability heuristic, usability principle","","","","","","","","2012","","Companion Proceedings of the 11th Brazilian Symposium on Human Factors in Computing Systems","IHC '12","","978-85-7669-262-1","Cuiaba, Brazil","Brazilian Computer Society","Porto Alegre, Brazil, Brazil"
"article","1056820","Nigel  Bevan","","","","Creating a UX Profession","1078--1079","","2","UX, international, profession, usability","10.1145/1056808.1056820","","","","","","","2005","","CHI '05 Extended Abstracts on Human Factors in Computing Systems","CHI EA '05","","1-59593-002-7","Portland, OR, USA","ACM","New York, NY, USA"
"article","1570493","Elspeth  Golden","","","","Helping Software Architects Design for Usability","317--320","","4","software architecture, usability","10.1145/1570433.1570493","","","","","","","2009","","Proceedings of the 1st ACM SIGCHI Symposium on Engineering Interactive Computing Systems","EICS '09","","978-1-60558-600-7","Pittsburgh, PA, USA","ACM","New York, NY, USA"
"article","1358693","Effie  Law and Virpi  Roto and Arnold P.O.S. Vermeeren and Joke  Kort and Marc  Hassenzahl","","","","Towards a Shared Definition of User Experience","2395--2398","","4","definition, usability, user experience","10.1145/1358628.1358693","","","","","","","2008","","CHI '08 Extended Abstracts on Human Factors in Computing Systems","CHI EA '08","","978-1-60558-012-8","Florence, Italy","ACM","New York, NY, USA"
"article","765939","Laurie  Roshak and Jared  Spool and Vanessa  Evers and Rolf  Molich and Colleen  Page and Ann-Byrd  Platt","","","","Evaluating Globally: How to Conduct International or Intercultural Usability Research","704--705","","2","","10.1145/765891.765939","","","","","","","2003","","CHI '03 Extended Abstracts on Human Factors in Computing Systems","CHI EA '03","","1-58113-637-4","Ft. Lauderdale, Florida, USA","ACM","New York, NY, USA"
"article","2598796","Arash  Soleimani","","","","CyberPLAYce: A Play Space of Creative, Intelligent Tools Promoting Personal and Computational Expression for Early Learners","191--194","","4","computer support tools, architecture, childhood education, interactive environments, prototyping, tangible computing, user-centered design","10.1145/2598784.2598796","","","","","","","2014","","Proceedings of the 2014 Companion Publication on Designing Interactive Systems","DIS Companion '14","","978-1-4503-2903-3","Vancouver, BC, Canada","ACM","New York, NY, USA"
"article","2702413","Katie  Davis and Eve  Klein","","","","Investigating High School Students' Perceptions of Digital Badges in Afterschool Learning","4043--4046","","4","digital badges, education, gamification, human factors","10.1145/2702123.2702413","","","","","","","2015","","Proceedings of the 33rd Annual ACM Conference on Human Factors in Computing Systems","CHI '15","","978-1-4503-3145-6","Seoul, Republic of Korea","ACM","New York, NY, USA"
"article","1297280","Helen  Edwards and Rachel  Benedyk","","","","A Comparison of Usability Evaluation Methods for Child Participants in a School Setting","9--16","","8","active intervention, child participants, cross-age tutoring, peer tutoring, school setting, usability evaluation","10.1145/1297277.1297280","","","","","","","2007","","Proceedings of the 6th International Conference on Interaction Design and Children","IDC '07","","978-1-59593-747-6","Aalborg, Denmark","ACM","New York, NY, USA"
"article","2254452","Isaias Horta Brazil and Wander Antunes Gaspar Valente","","","","Usabilidade e Carga De Trabalho: Um Estudo De Caso Para a Preven\c{C}\~{A}O De Doen\c{C}As Ocupacionais Em Inform\'{A}Tica","71--80","","10","HCI, ergonomics, usability engineering","","","","","","","","2011","","Proceedings of the 10th Brazilian Symposium on Human Factors in Computing Systems and the 5th Latin American Conference on Human-Computer Interaction","IHC+CLIHC '11","","978-85-7669-257-7","Porto de Galinhas, Pernambuco, Brazil","Brazilian Computer Society","Porto Alegre, Brazil, Brazil"
"article","1062581","Matthew J. Hawthorne and Dewayne E. Perry","","","","Software Engineering Education in the Era of Outsourcing, Distributed Development, and Open Source Software: Challenges and Opportunities","643--644","","2","computer science education, contextual learning, education, informatics, software engineering education","10.1145/1062455.1062581","","","","","","","2005","","Proceedings of the 27th International Conference on Software Engineering","ICSE '05","","1-58113-963-2","St. Louis, MO, USA","ACM","New York, NY, USA"
"article","1718957","Umer  Farooq and Dieter  Zirkler","","","","API Peer Reviews: A Method for Evaluating Usability of Application Programming Interfaces","207--210","","4","api usability, cognitive dimensions, usability inspection","10.1145/1718918.1718957","","","","","","","2010","","Proceedings of the 2010 ACM Conference on Computer Supported Cooperative Work","CSCW '10","","978-1-60558-795-0","Savannah, Georgia, USA","ACM","New York, NY, USA"
"article","63344","S. L. Young and A. G. Hauptmann and W. H. Ward and E. T. Smith and P.  Werner","","","","High Level Knowledge Sources in Usable Speech Recognition Systems","183--194","","12","","10.1145/63342.63344","Commun. ACM","Feb. 1989","32","2","","February","1989","0001-0782","","","","","","ACM","New York, NY, USA"
"article","2598600","Craig M. MacDonald and Michael E. Atwood","","","","What Does It Mean for a System to Be Useful?: An Exploratory Study of Usefulness","885--894","","10","evaluation, usability, usefulness, ux","10.1145/2598510.2598600","","","","","","","2014","","Proceedings of the 2014 Conference on Designing Interactive Systems","DIS '14","","978-1-4503-2902-6","Vancouver, BC, Canada","ACM","New York, NY, USA"
"article","2381441","Angela  Mahr and Christoph  Endres and Christian  M&#252;ller and Tanja  Schneeberger","","","","Determining Human-centered Parameters of Ergonomic Micro-gesture Interaction for Drivers Using the Theater Approach","151--158","","8","contact-free, driving, ergonomics, micro-gestures, modality, parameters, steering wheel, theater approach, usability","10.1145/2381416.2381441","","","","","","","2011","","Proceedings of the 3rd International Conference on Automotive User Interfaces and Interactive Vehicular Applications","AutomotiveUI '11","","978-1-4503-1231-8","Salzburg, Austria","ACM","New York, NY, USA"
"article","3133294","Santi  Ritthiron and Arisara  Jiamsanguanwong","","","","Usability Evaluation of the University Library Network's Website Using an Eye-Tracking Device","184--188","","5","Usability evaluation, eye-tracking, usability testing, website","10.1145/3133264.3133294","","","","","","","2017","","Proceedings of the International Conference on Advances in Image Processing","ICAIP 2017","","978-1-4503-5295-6","Bangkok, Thailand","ACM","New York, NY, USA"
"article","3131203","Lisa K. Meloncon","","","","Patient Experience Design: Expanding Usability Methodologies for Healthcare","19--28","","10","embodiment, health literacy, methodology, patient education materials, usability","10.1145/3131201.3131203","Commun. Des. Q. Rev","July 2017","5","2","","August","2017","2166-1200","","","","","","ACM","New York, NY, USA"
"article","1385123","Mohammed  AlZomai and Bander  AlFayyadh and Audun  J&#248;sang and Adrian  McCullagh","","","","An Exprimental Investigation of the Usability of Transaction Authorization in Online Bank Security Systems","65--73","","9","authentication, authorization, identity management, online banking, security, usability","","","","","","","","2008","","Proceedings of the Sixth Australasian Conference on Information Security - Volume 81","AISC '08","","978-1-920682-62-0","Wollongong, NSW, Australia","Australian Computer Society, Inc.","Darlinghurst, Australia, Australia"
"article","1508941","Craig  Mundie","","","","Rethinking Computing","203--203","","1","computing","10.1145/1539024.1508941","SIGCSE Bull.","March 2009","41","1","","March","2009","0097-8418","","","","","","ACM","New York, NY, USA"
"article","1508941","Craig  Mundie","","","","Rethinking Computing","203--203","","1","computing","10.1145/1508865.1508941","","","","","","","2009","","Proceedings of the 40th ACM Technical Symposium on Computer Science Education","SIGCSE '09","","978-1-60558-183-5","Chattanooga, TN, USA","ACM","New York, NY, USA"
