"type","id","author","editor","advisor","note","title","pages","article_no","num_pages","keywords","doi","journal","issue_date","volume","issue_no","description","month","year","issn","booktitle","acronym","edition","isbn","conf_loc","publisher","publisher_loc"
"article","2538972","Jennifer S. Kay and Janet G. Moss and Shelly  Engelman and Tom  McKlin","","","","Sneaking in Through the Back Door: Introducing K-12 Teachers to Robot Programming","499--504","","6","K-12 education, computer science education, education standards, educational robotics, non-majors","10.1145/2538862.2538972","","","","","","","2014","","Proceedings of the 45th ACM Technical Symposium on Computer Science Education","SIGCSE '14","","978-1-4503-2605-6","Atlanta, Georgia, USA","ACM","New York, NY, USA"
"article","3017755","Sara  Vogel and Rafi  Santo and Dixie  Ching","","","","Visions of Computer Science Education: Unpacking Arguments for and Projected Impacts of CS4All Initiatives","609--614","","6","CS education purposes, CS4All, arguments for CS education, universal computer science education, visions of CS education","10.1145/3017680.3017755","","","","","","","2017","","Proceedings of the 2017 ACM SIGCSE Technical Symposium on Computer Science Education","SIGCSE '17","","978-1-4503-4698-6","Seattle, Washington, USA","ACM","New York, NY, USA"
"article","1125663","Shailey  Minocha and Marian  Petre and Ekaterini  Tzanidou and Geke  van Dijk and Dave  Roberts and Nick  Gassman and Nicola  Millard and Barry  Day and David  Travis","","","","Evaluating e-Commerce Environments: Approaches to Cross-disciplinary Investigation","1121--1126","","6","consumer behaviour, e-commerce, expectations, relationship marketing, usability, usability techniques","10.1145/1125451.1125663","","","","","","","2006","","CHI '06 Extended Abstracts on Human Factors in Computing Systems","CHI EA '06","","1-59593-298-4","Montr&#233;al, Qu&#233;bec, Canada","ACM","New York, NY, USA"
"article","1358689","Rolf  Molich and Chauncey  Wilson","","","","Tips and Tricks for Avoiding Common Problems in Usability Test Facilitation","2379--2382","","4","evaluation, facilitation, quality assurance, usability test problems, usability testing","10.1145/1358628.1358689","","","","","","","2008","","CHI '08 Extended Abstracts on Human Factors in Computing Systems","CHI EA '08","","978-1-60558-012-8","Florence, Italy","ACM","New York, NY, USA"
"article","286559","Nigel  Bevan and Ian  Curson","","","","Planning and Implementing User-centred Design","111--112","","2","engineering, standards, usability, usability evaluation, user-centred design","10.1145/286498.286559","","","","","","","1998","","CHI 98 Conference Summary on Human Factors in Computing Systems","CHI '98","","1-58113-028-7","Los Angeles, California, USA","ACM","New York, NY, USA"
"article","2018435","Holger  R&#246;der","","","","A Pattern Approach to Specifying Usability Features in Use Cases","12--15","","4","software requirements specification, usability, usability patterns, use cases","10.1145/2018431.2018435","","","","","","","2011","","Proceedings of the 2Nd International Workshop on Pattern-Driven Engineering of Interactive Computing Systems","PEICS '11","","978-1-4503-0856-4","Pisa, Italy","ACM","New York, NY, USA"
"article","2393170","Linfeng  Li and Marko  Helenius and Eleni  Berki","","","","A Usability Test of Whitelist and Blacklist-based Anti-phishing Application","195--202","","8","phishing, phishing prevention, usability","10.1145/2393132.2393170","","","","","","","2012","","Proceeding of the 16th International Academic MindTrek Conference","MindTrek '12","","978-1-4503-1637-8","Tampere, Finland","ACM","New York, NY, USA"
"article","2536571","N&#233;lida  Hierro and Nikolaos  Galanis and Enric  Mayol and Maria Jos&#233; Casany and Marc  Alier","","","","Using a Pull Mechanism for Connecting an Informal Learning Collector with External Applications","225--229","","5","informal learning, lifelong learning, push and pull mechanisms, usability","10.1145/2536536.2536571","","","","","","","2013","","Proceedings of the First International Conference on Technological Ecosystem for Enhancing Multiculturality","TEEM '13","","978-1-4503-2345-1","Salamanca, Spain","ACM","New York, NY, USA"
"article","347795","Jan O. Borchers","","","","A Pattern Approach to Interaction Design","369--378","","10","design methodologies, education, exhibits, interdisciplinary design, music, pattern languages","10.1145/347642.347795","","","","","","","2000","","Proceedings of the 3rd Conference on Designing Interactive Systems: Processes, Practices, Methods, and Techniques","DIS '00","","1-58113-219-0","New York City, New York, USA","ACM","New York, NY, USA"
"article","1640296","Julie L. Baher and Bill  Westerman","","","","The Usability of Creativity: Experts V. Novices","351--352","","2","creativity, photoshop, software, usability","10.1145/1640233.1640296","","","","","","","2009","","Proceedings of the Seventh ACM Conference on Creativity and Cognition","C&#38;C '09","","978-1-60558-865-0","Berkeley, California, USA","ACM","New York, NY, USA"
"article","2335364","Emilee  Rader and Rick  Wash and Brandon  Brooks","","","","Stories As Informal Lessons About Security","6:1--6:17","6","17","mental models, security stories, stories, storytelling","10.1145/2335356.2335364","","","","","","","2012","","Proceedings of the Eighth Symposium on Usable Privacy and Security","SOUPS '12","","978-1-4503-1532-6","Washington, D.C.","ACM","New York, NY, USA"
"article","1837125","Rick  Wash","","","","Folk Models of Home Computer Security","11:1--11:16","11","16","folk models, home security, mental models","10.1145/1837110.1837125","","","","","","","2010","","Proceedings of the Sixth Symposium on Usable Privacy and Security","SOUPS '10","","978-1-4503-0264-7","Redmond, Washington, USA","ACM","New York, NY, USA"
"article","1289317","Kimberly W. Bartholomew and Thor A. Anderson and Anne  Arendt","","","","Game Show Usability Testing Workshop","181--182","","2","","","J. Comput. Sci. Coll.","October 2007","23","1","","October","2007","1937-4771","","","","","","Consortium for Computing Sciences in Colleges","USA"
"article","3012527","Ana M. Santos","","","","Evaluation of Educational Websites to Support Primary and High School in Portugal","261--267","","7","education, evaluation criteria, evaluation of educational websites, high school, primary school, teaching","10.1145/3012430.3012527","","","","","","","2016","","Proceedings of the Fourth International Conference on Technological Ecosystems for Enhancing Multiculturality","TEEM '16","","978-1-4503-4747-1","Salamanca, Spain","ACM","New York, NY, USA"
"article","2523550","Lihui  Hu and Jean  Mayo and Charles  Wallace","","","","An Empirical Study of Three Access Control Systems","287--291","","5","access control, usability","10.1145/2523514.2523550","","","","","","","2013","","Proceedings of the 6th International Conference on Security of Information and Networks","SIN '13","","978-1-4503-2498-4","Aksaray, Turkey","ACM","New York, NY, USA"
"article","1900119","Mary  Brown and Felicia R. Doswell","","","","Using Passtones Instead of Passwords","82:1--82:5","82","5","accessibility, authentication, computers and society, usable security","10.1145/1900008.1900119","","","","","","","2010","","Proceedings of the 48th Annual Southeast Regional Conference","ACM SE '10","","978-1-4503-0064-3","Oxford, Mississippi","ACM","New York, NY, USA"
"article","2468549","Miaoqi  Zhu and Xiaowen  Fang and Susy S. Chan and Jacek  Brzezinski","","","","Building a Dictionary of Game-descriptive Words to Study Playability","1077--1082","","6","computer games, lexical analysis, playability, usability","10.1145/2468356.2468549","","","","","","","2013","","CHI '13 Extended Abstracts on Human Factors in Computing Systems","CHI EA '13","","978-1-4503-1952-2","Paris, France","ACM","New York, NY, USA"
"article","2856679","Jonathan  Lazar and Simone D.J. Barbosa","","","","Introduction To Human Computer Interaction","933--935","","3","human-computer interaction, usability, user experience","10.1145/2851581.2856679","","","","","","","2016","","Proceedings of the 2016 CHI Conference Extended Abstracts on Human Factors in Computing Systems","CHI EA '16","","978-1-4503-4082-3","San Jose, California, USA","ACM","New York, NY, USA"
"article","3136284","Georgia  Koloniari","","","","Evaluating the Use of an Interactive Software Tool for Learning BCNF Normalization","27:1--27:8","27","8","BCNF, assessment, educational tool, evaluation study","10.1145/3136273.3136284","","","","","","","2017","","Proceedings of the 8th Balkan Conference in Informatics","BCI '17","","978-1-4503-5285-7","Skopje, Macedonia","ACM","New York, NY, USA"
"article","634155","Marion  Walton","","","","Multiliteracies and Tumi's Web Search: A Case Study","143--144","","2","South Africa, literacy, multiliteracies, usability","10.1145/634067.634155","","","","","","","2001","","CHI '01 Extended Abstracts on Human Factors in Computing Systems","CHI EA '01","","1-58113-340-5","Seattle, Washington","ACM","New York, NY, USA"
"article","2732748","Christos  Fidas and Heinrich  Hussmann and Marios  Belk and George  Samaras","","","","iHIP: Towards a User Centric Individual Human Interaction Proof Framework","2235--2240","","6","CAPTCHA, framework design, usable security","10.1145/2702613.2732748","","","","","","","2015","","Proceedings of the 33rd Annual ACM Conference Extended Abstracts on Human Factors in Computing Systems","CHI EA '15","","978-1-4503-3146-3","Seoul, Republic of Korea","ACM","New York, NY, USA"
"article","2525265","Niharika  Sachdeva and Nitesh  Saxena and Ponnurangam  Kumaraguru","","","","On the Viability of CAPTCHAs for Use in Telephony Systems: A Usability Field Study","178--182","","5","CAPTCHA, human-mobile interaction, usability","10.1145/2525194.2525265","","","","","","","2013","","Proceedings of the 11th Asia Pacific Conference on Computer Human Interaction","APCHI '13","","978-1-4503-2253-9","Bangalore, India","ACM","New York, NY, USA"
"article","1753384","Philip G. Inglesant and M. Angela Sasse","","","","The True Cost of Unusable Password Policies: Password Use in the Wild","383--392","","10","password policy, passwords, usable security","10.1145/1753326.1753384","","","","","","","2010","","Proceedings of the SIGCHI Conference on Human Factors in Computing Systems","CHI '10","","978-1-60558-929-9","Atlanta, Georgia, USA","ACM","New York, NY, USA"
"article","2639218","Emanuel  von Zezschwitz and Alexander  De Luca and Heinrich  Hussmann","","","","Honey, I Shrunk the Keys: Influences of Mobile Devices on Password Composition and Authentication Performance","461--470","","10","mobile devices, passwords, performance, usability","10.1145/2639189.2639218","","","","","","","2014","","Proceedings of the 8th Nordic Conference on Human-Computer Interaction: Fun, Fast, Foundational","NordiCHI '14","","978-1-4503-2542-4","Helsinki, Finland","ACM","New York, NY, USA"
"article","2038479","Mexhid  Ferati and Steve  Mannheimer and Davide  Bolchini","","","","Usability Evaluation of Acoustic Interfaces for the Blind","9--16","","8","acoustic, audeme, auditory communication, auditory design, blind and visually impaired, children, interface, sound, touchscreen, usability evaluation","10.1145/2038476.2038479","","","","","","","2011","","Proceedings of the 29th ACM International Conference on Design of Communication","SIGDOC '11","","978-1-4503-0936-3","Pisa, Italy","ACM","New York, NY, USA"
"article","2910938","Richard J. Sutcliffe and Benjamin  Kowarsch","","","","Closing the Barn Door: Re-Prioritizing Safety, Security, and Reliability","1:1--1:15","1","15","Education, Modula-2, Reliability, Safety, Security, Software Engineering","10.1145/2910925.2910938","","","","","","","2016","","Proceedings of the 21st Western Canadian Conference on Computing Education","WCCCE '16","","978-1-4503-4355-8","Kamloops, BC, Canada","ACM","New York, NY, USA"
"article","1297165","David G. Novick and Edith  Elizalde and Nathaniel  Bean","","","","Toward a More Accurate View of when and How People Seek Help with Computer Applications","95--102","","8","documentation, evaluation, usability","10.1145/1297144.1297165","","","","","","","2007","","Proceedings of the 25th Annual ACM International Conference on Design of Communication","SIGDOC '07","","978-1-59593-588-5","El Paso, Texas, USA","ACM","New York, NY, USA"
"article","1226997","Angela  Chang and James  Gouldstone and Jamie  Zigelbaum and Hiroshi  Ishii","","","","Simplicity in Interaction Design","135--138","","4","expressiveness, interface design, simplicity, usability","10.1145/1226969.1226997","","","","","","","2007","","Proceedings of the 1st International Conference on Tangible and Embedded Interaction","TEI '07","","978-1-59593-619-6","Baton Rouge, Louisiana","ACM","New York, NY, USA"
"article","1040835","Boris  de Ruyter and Yogendra  Jain and David  Keyson and Charles  Rich","","","","The Usability Crisis in High-tech Home Products: An Opportunity for Intelligent User Interfaces?","4--4","","1","consumer electronics, usability","10.1145/1040830.1040835","","","","","","","2005","","Proceedings of the 10th International Conference on Intelligent User Interfaces","IUI '05","","1-58113-894-6","San Diego, California, USA","ACM","New York, NY, USA"
"article","1693117","Roc&#237;o Andrea Rodr&#237;guez and Daniel Alberto Giulianelli and Pablo Mart&#237;n Vera","","","","Extended Measurement Framework for Analyzing e-Governance Situation in Different Countries","359--364","","6","accessibility, egovernance, friendliness, navigability, usability","10.1145/1693042.1693117","","","","","","","2009","","Proceedings of the 3rd International Conference on Theory and Practice of Electronic Governance","ICEGOV '09","","978-1-60558-663-2","Bogota, Colombia","ACM","New York, NY, USA"
"article","2507086","Clare  Cotugno and Shannon L. Fitzhugh and Raegen  Hoeft","","","","Simplifying Business Complexity with Frameworks","33--38","","6","business processes, content management, content strategy, ergonomics, human factors, macroergonomics, usability, user experience design","10.1145/2507065.2507086","","","","","","","2013","","Proceedings of the 31st ACM International Conference on Design of Communication","SIGDOC '13","","978-1-4503-2131-0","Greenville, North Carolina, USA","ACM","New York, NY, USA"
"article","1168169","Eliane R. A. Valiati and Marcelo S. Pimenta and Carla M. D. S. Freitas","","","","A Taxonomy of Tasks for Guiding the Evaluation of Multidimensional Visualizations","1--6","","6","information visualization, usability evaluation","10.1145/1168149.1168169","","","","","","","2006","","Proceedings of the 2006 AVI Workshop on BEyond Time and Errors: Novel Evaluation Methods for Information Visualization","BELIV '06","","1-59593-562-2","Venice, Italy","ACM","New York, NY, USA"
"issue","2835658","","","","","","","","","","","J. Usability Studies","February 2006","1","2","","February","2006","","","","","","","Usability Professionals' Association","Bloomingdale, IL"
"issue","2835445","","","","","","","","","","","J. Usability Studies","November 2011","7","1","","November","2011","","","","","","","Usability Professionals' Association","Bloomingdale, IL"
"issue","2835562","","","","","","","","","","","J. Usability Studies","February 2008","3","2","","February","2008","","","","","","","Usability Professionals' Association","Bloomingdale, IL"
"issue","2835592","","","","","","","","","","","J. Usability Studies","August 2009","4","4","","August","2009","","","","","","","Usability Professionals' Association","Bloomingdale, IL"
"article","2808064","Chi  Zhang and Xihui  Zhang and Richard  Halstead-Nussloch","","","","Validating the Assessment Metrics for Mobile Health Apps: Preliminary Outcomes from a Pilot Study","41--41","","1","assessment metrics, health app, medical app, usability","10.1145/2808062.2808064","","","","","","","2015","","Proceedings of the 4th Annual ACM Conference on Research in Information Technology","RIIT '15","","978-1-4503-3836-3","Chicago, Illinois, USA","ACM","New York, NY, USA"
"article","1297948","Emerson  Murphy-Hill","","","","Activating Refactorings Faster","925--926","","2","environments, refactoring tools, usability","10.1145/1297846.1297948","","","","","","","2007","","Companion to the 22Nd ACM SIGPLAN Conference on Object-oriented Programming Systems and Applications Companion","OOPSLA '07","","978-1-59593-865-7","Montreal, Quebec, Canada","ACM","New York, NY, USA"
"article","1176678","Emerson  Murphy-Hill and Andrew P. Black","","","","Tools for a Successful Refactoring","694--695","","2","environments, refactoring, tools, usability","10.1145/1176617.1176678","","","","","","","2006","","Companion to the 21st ACM SIGPLAN Symposium on Object-oriented Programming Systems, Languages, and Applications","OOPSLA '06","","1-59593-491-X","Portland, Oregon, USA","ACM","New York, NY, USA"
"article","1622005","Matthew J. Bell and Colin H.C. Machin","","","","A Framework for Adaptive Communication Design","45--50","","6","accessibility, adaptability, usability","10.1145/1621995.1622005","","","","","","","2009","","Proceedings of the 27th ACM International Conference on Design of Communication","SIGDOC '09","","978-1-60558-559-8","Bloomington, Indiana, USA","ACM","New York, NY, USA"
"article","1140535","Mario  Valle","","","","Representations That Promote Cognition: The Case of Chemistry Visualization Tools","158--158","","1","molecular visualization, usability","10.1145/1140491.1140535","","","","","","","2006","","Proceedings of the 3rd Symposium on Applied Perception in Graphics and Visualization","APGV '06","","1-59593-429-4","Boston, Massachusetts, USA","ACM","New York, NY, USA"
"article","1176705","Emerson  Murphy-Hill","","","","Improving Usability of Refactoring Tools","746--747","","2","environments, refactoring, tools, usability","10.1145/1176617.1176705","","","","","","","2006","","Companion to the 21st ACM SIGPLAN Symposium on Object-oriented Programming Systems, Languages, and Applications","OOPSLA '06","","1-59593-491-X","Portland, Oregon, USA","ACM","New York, NY, USA"
"article","2664662","Wolfgang  Slany","","","","Pocket Code: A Scratch-like Integrated Development Environment for Your Phone","35--36","","2","computer science education, kids, mobile app, smartphones, stem, teenagers, visual programming","10.1145/2660252.2664662","","","","","","","2014","","Proceedings of the Companion Publication of the 2014 ACM SIGPLAN Conference on Systems, Programming, and Applications: Software for Humanity","SPLASH '14","","978-1-4503-3208-8","Portland, Oregon, USA","ACM","New York, NY, USA"
"article","2401799","Teemu  Sirki&#228; and Juha  Sorva","","","","Exploring Programming Misconceptions: An Analysis of Student Mistakes in Visual Program Simulation Exercises","19--28","","10","CS1, introductory programming education, misconceptions, program visualization, visual program simulation","10.1145/2401796.2401799","","","","","","","2012","","Proceedings of the 12th Koli Calling International Conference on Computing Education Research","Koli Calling '12","","978-1-4503-1795-5","Koli, Finland","ACM","New York, NY, USA"
"article","1572557","Roel  Peeters and Markulf  Kohlweiss and Bart  Preneel and Nicky  Sulmon","","","","Threshold Things That Think: Usable Authorization for Resharing","18:1--18:1","18","1","","10.1145/1572532.1572557","","","","","","","2009","","Proceedings of the 5th Symposium on Usable Privacy and Security","SOUPS '09","","978-1-60558-736-3","Mountain View, California, USA","ACM","New York, NY, USA"
"article","2335375","Vivek  Krishnan and Mahesh V. Tripunitara and Kinson  Chik and Tony  Bergstrom","","","","Relating Declarative Semantics and Usability in Access Control","14:1--14:13","14","13","POSIX, access control lists, declarative, semantics","10.1145/2335356.2335375","","","","","","","2012","","Proceedings of the Eighth Symposium on Usable Privacy and Security","SOUPS '12","","978-1-4503-1532-6","Washington, D.C.","ACM","New York, NY, USA"
"article","2638766","William  Widjaja and Masayuki  Sawamura","","","","Bring Your Own Device: Ubiquitous Approach to Digital Affinity Diagram Collaboration","287--290","","4","CSCW, affinity-diagram, brainstorming, collaboration, ubiquitous computing","10.1145/2638728.2638766","","","","","","","2014","","Proceedings of the 2014 ACM International Joint Conference on Pervasive and Ubiquitous Computing: Adjunct Publication","UbiComp '14 Adjunct","","978-1-4503-3047-3","Seattle, Washington","ACM","New York, NY, USA"
"article","2167037","Pramod  Verma","","","","icAuth: Image-color Based Authentication System","329--330","","2","iba, security, usability","10.1145/2166966.2167037","","","","","","","2012","","Proceedings of the 2012 ACM International Conference on Intelligent User Interfaces","IUI '12","","978-1-4503-1048-2","Lisbon, Portugal","ACM","New York, NY, USA"
"article","1556319","Eliane Regina de Almeida Valiati and Marcelo Soares Pimenta","","","","Assessment of Cost/Benefit of Interfaces Evaluation Techniques","355--356","","2","cost/benefit, evaluation techniques, usability","10.1145/1556262.1556319","","","","","","","2002","","Proceedings of the Working Conference on Advanced Visual Interfaces","AVI '02","","1-58113-537-8","Trento, Italy","ACM","New York, NY, USA"
"article","2335369","Maritza  Johnson and Serge  Egelman and Steven M. Bellovin","","","","Facebook and Privacy: It's Complicated","9:1--9:15","9","15","access control, privacy, social networking","10.1145/2335356.2335369","","","","","","","2012","","Proceedings of the Eighth Symposium on Usable Privacy and Security","SOUPS '12","","978-1-4503-1532-6","Washington, D.C.","ACM","New York, NY, USA"
"article","236558","David  Carlson and Mark  Guzdial and Colleen  Kehoe and Viren  Shah and John  Stasko","","","","WWW Interactive Learning Environments for Computer Science Education","290--294","","5","","10.1145/236462.236558","SIGCSE Bull.","March 1996","28","1","","March","1996","0097-8418","","","","","","ACM","New York, NY, USA"
"article","236558","David  Carlson and Mark  Guzdial and Colleen  Kehoe and Viren  Shah and John  Stasko","","","","WWW Interactive Learning Environments for Computer Science Education","290--294","","5","","10.1145/236452.236558","","","","","","","1996","","Proceedings of the Twenty-seventh SIGCSE Technical Symposium on Computer Science Education","SIGCSE '96","","0-89791-757-X","Philadelphia, Pennsylvania, USA","ACM","New York, NY, USA"
"article","2721957","Christian  K&#246;ppe and Michel  Portier","","","","Lecture Design Patterns: Improving the Beginning of a Lecture","16:1--16:12","16","12","design patterns, education, educational patterns","10.1145/2721956.2721957","","","","","","","2014","","Proceedings of the 19th European Conference on Pattern Languages of Programs","EuroPLoP '14","","978-1-4503-3416-7","Irsee, Germany","ACM","New York, NY, USA"
"article","1168827","Fred  Gutierrez","","","","Stingray: A Hands-on Approach to Learning Information Security","53--58","","6","IT education, information security education","10.1145/1168812.1168827","","","","","","","2006","","Proceedings of the 7th Conference on Information Technology Education","SIGITE '06","","1-59593-521-5","Minneapolis, Minnesota, USA","ACM","New York, NY, USA"
"article","2445360","Suzanne Fox Buchele","","","","Two Models of a Cryptography and Computer Security Class in a Liberal Arts Context","543--548","","6","computer security, computer security education, cryptography, cryptology","10.1145/2445196.2445360","","","","","","","2013","","Proceeding of the 44th ACM Technical Symposium on Computer Science Education","SIGCSE '13","","978-1-4503-1868-6","Denver, Colorado, USA","ACM","New York, NY, USA"
"article","1275650","Timothy  Urness","","","","Teaching Computer Organization/Architecture by Building a Computer","72--76","","5","computer architecture, computer science education, hardware","10.1145/1275633.1275650","","","","","","","2007","","Proceedings of the 2007 Workshop on Computer Architecture Education","WCAE '07","","978-1-59593-797-1","San Diego, California","ACM","New York, NY, USA"
"article","3105730","Sandra  Schulz","","","","Physical Computing As an Inquiry Working Technique","269--270","","2","computer science education, inquiry learning, physical computing","10.1145/3105726.3105730","","","","","","","2017","","Proceedings of the 2017 ACM Conference on International Computing Education Research","ICER '17","","978-1-4503-4968-0","Tacoma, Washington, USA","ACM","New York, NY, USA"
"article","2481486","Roger D. Boyle and Hannah M. Dee and Fr&#233;d&#233;ric  Labrosse","","","","Technocamps: Bringing Computer Science to the Far West","147--148","","2","Wales, computer science, computer science education, schools","10.1145/2481449.2481486","","","","","","","2012","","Proceedings of the 7th Workshop in Primary and Secondary Computing Education","WiPSCE '12","","978-1-4503-1787-0","Hamburg, Germany","ACM","New York, NY, USA"
"article","3017730","J. Michael Fitzpatrick and &#193;kos  L&#233;deczi and Gayathri  Narasimham and Lee  Lafferty and R&#233;al  Labrie and Paul T. Mielke and Aatish  Kumar and Katherine A. Brady","","","","Lessons Learned in the Design and Delivery of an Introductory Programming MOOC","219--224","","6","MATLAB, MOOC, computer programming, computer science education","10.1145/3017680.3017730","","","","","","","2017","","Proceedings of the 2017 ACM SIGCSE Technical Symposium on Computer Science Education","SIGCSE '17","","978-1-4503-4698-6","Seattle, Washington, USA","ACM","New York, NY, USA"
